10001,STU-00001,Daniel,Chavez,2007-12-16,SCH-007,"Castilla Science High School"
2001,BS-002,Luis,Ramos,2007-11-19,SCH-003,"Gubat Central School"
10002,STU-00002,Miguel,Santos,2008-11-16,SCH-005,"Barcelona Central School"
10003,STU-00003,Cristina,Jimenez,2009-07-10,SCH-002,"Bulan Science High School"
2002,BS-003,Andrea,Luna,2005-11-01,SCH-004,"Irosin National High School"
10004,STU-00004,Margarita,Aguilar,2010-08-16,SCH-010,"Matnog National High School"
2003,BS-004,Enrique,Castro,2010-09-18,SCH-002,"Bulan Science High School"
10005,STU-00005,Maria,Gutierrez,2010-03-25,SCH-001,"Sorsogon National High School"